[
  {
    "allocation_id": "alloc_36d000a6cb",
    "incident_id": "INC_TEST_02",
    "incident_category": "not_humanitarian",
    "urgency_level": "CRITICAL",
    "verification_status": "CONTRADICTED_BY_EVIDENCE",
    "incident_location": {
      "latitude": 28.6619,
      "longitude": 77.2492,
      "nearest_osm_node": 6863884217
    },
    "required_resource_type": "FIRE_TENDER",
    "demanded_quantity": 2,
    "assigned_resource_id": null,
    "assigned_depot_id": null,
    "assigned_quantity": 0,
    "unmet_quantity": 2,
    "travel_distance_km": null,
    "estimated_travel_time_min": null,
    "routing_method": "NOT_APPLICABLE",
    "allocation_status": "INFEASIBLE",
    "priority_rationale": "Incident contradicted by authoritative evidence. Real-world dispatch prohibited.",
    "feasibility_status": "UNVERIFIED_GATE",
    "human_approval_required": true,
    "timestamp": "2026-10-09T10:52:59.474609+00:00",
    "provenance": "crisisguard_milp_highs_optimizer_v1"
  },
  {
    "allocation_id": "alloc_c3c2df8d60",
    "incident_id": "INC_TEST_01",
    "incident_category": "affected_individuals",
    "urgency_level": "HIGH",
    "verification_status": "EVIDENCE_SUPPORTED",
    "incident_location": {
      "latitude": 28.6279,
      "longitude": 77.2784,
      "nearest_osm_node": 6863884217
    },
    "required_resource_type": "RESCUE_BOAT",
    "demanded_quantity": 2,
    "assigned_resource_id": null,
    "assigned_depot_id": null,
    "assigned_quantity": 0,
    "unmet_quantity": 2,
    "travel_distance_km": null,
    "estimated_travel_time_min": null,
    "routing_method": "UNREACHABLE",
    "allocation_status": "UNALLOCATED",
    "priority_rationale": "All compatible depots are road-network unreachable from incident location.",
    "feasibility_status": "INFEASIBLE_UNREACHABLE",
    "human_approval_required": true,
    "timestamp": "2026-10-09T10:52:59.399993+00:00",
    "provenance": "crisisguard_milp_highs_optimizer_v1"
  },
  {
    "allocation_id": "alloc_10b4fab34b",
    "incident_id": "INC_02_BRIDGE_COLLAPSE",
    "incident_category": "not_humanitarian",
    "urgency_level": "CRITICAL",
    "verification_status": "CONTRADICTED_BY_EVIDENCE",
    "incident_location": {
      "latitude": 6.7176,
      "longitude": 72.9444,
      "nearest_osm_node": 10728833226
    },
    "required_resource_type": "FIRE_TENDER",
    "demanded_quantity": 3,
    "assigned_resource_id": null,
    "assigned_depot_id": null,
    "assigned_quantity": 0,
    "unmet_quantity": 3,
    "travel_distance_km": null,
    "estimated_travel_time_min": null,
    "routing_method": "NOT_APPLICABLE",
    "allocation_status": "INFEASIBLE",
    "priority_rationale": "Incident contradicted by authoritative evidence. Real-world dispatch prohibited.",
    "feasibility_status": "UNVERIFIED_GATE",
    "human_approval_required": true,
    "timestamp": "2026-10-09T07:35:43.598051+00:00",
    "provenance": "crisisguard_milp_highs_optimizer_v1"
  },
  {
    "allocation_id": "alloc_75d083aa17",
    "incident_id": "INC_04_METRO_TRAUMA_STANDBY",
    "incident_category": "infrastructure_and_utility_damage",
    "urgency_level": "MEDIUM",
    "verification_status": "INSUFFICIENT_EVIDENCE",
    "incident_location": {
      "latitude": 6.7718,
      "longitude": 73.1271,
      "nearest_osm_node": 208410771
    },
    "required_resource_type": "AMBULANCE",
    "demanded_quantity": 2,
    "assigned_resource_id": "RES_AMB_01",
    "assigned_depot_id": "DEPOT_CIVIL_HOSPITAL",
    "assigned_quantity": 2,
    "unmet_quantity": 0,
    "travel_distance_km": 0.0,
    "estimated_travel_time_min": 0.0,
    "routing_method": "OSM_DIJKSTRA",
    "allocation_status": "RECOMMENDED",
    "priority_rationale": "Optimally allocated 2/2 unit(s) from DEPOT_CIVIL_HOSPITAL (RES_AMB_01) based on urgency MEDIUM and travel time 0.0m.",
    "feasibility_status": "FEASIBLE",
    "human_approval_required": true,
    "timestamp": "2026-10-09T10:49:58.978084+00:00",
    "provenance": "crisisguard_milp_highs_optimizer_v1"
  },
  {
    "allocation_id": "alloc_2e575896d2",
    "incident_id": "INC_01_SECTOR5_FLOOD",
    "incident_category": "rescue_volunteering_or_donation_effort",
    "urgency_level": "CRITICAL",
    "verification_status": "EVIDENCE_SUPPORTED",
    "incident_location": {
      "latitude": 6.717,
      "longitude": 72.9486,
      "nearest_osm_node": 208413043
    },
    "required_resource_type": "RESCUE_BOAT",
    "demanded_quantity": 4,
    "assigned_resource_id": "RES_BOAT_01",
    "assigned_depot_id": "DEPOT_YAMUNA_EAST",
    "assigned_quantity": 4,
    "unmet_quantity": 0,
    "travel_distance_km": 0.0,
    "estimated_travel_time_min": 0.0,
    "routing_method": "OSM_DIJKSTRA",
    "allocation_status": "RECOMMENDED",
    "priority_rationale": "Optimally allocated 4/4 unit(s) from DEPOT_YAMUNA_EAST (RES_BOAT_01) based on urgency CRITICAL and travel time 0.0m.",
    "feasibility_status": "FEASIBLE",
    "human_approval_required": true,
    "timestamp": "2026-10-09T07:35:43.604654+00:00",
    "provenance": "crisisguard_milp_highs_optimizer_v1"
  },
  {
    "allocation_id": "alloc_251cb34870",
    "incident_id": "INC_03_ITO_LOW_LYING",
    "incident_category": "affected_individuals",
    "urgency_level": "HIGH",
    "verification_status": "EVIDENCE_SUPPORTED",
    "incident_location": {
      "latitude": 6.7174,
      "longitude": 72.9482,
      "nearest_osm_node": 208413047
    },
    "required_resource_type": "RESCUE_BOAT",
    "demanded_quantity": 4,
    "assigned_resource_id": "RES_BOAT_02",
    "assigned_depot_id": "DEPOT_RIVER_NORTH",
    "assigned_quantity": 4,
    "unmet_quantity": 0,
    "travel_distance_km": 0.0,
    "estimated_travel_time_min": 0.0,
    "routing_method": "OSM_DIJKSTRA",
    "allocation_status": "RECOMMENDED",
    "priority_rationale": "Optimally allocated 4/4 unit(s) from DEPOT_RIVER_NORTH (RES_BOAT_02) based on urgency HIGH and travel time 0.0m.",
    "feasibility_status": "FEASIBLE",
    "human_approval_required": true,
    "timestamp": "2026-10-09T07:35:43.606236+00:00",
    "provenance": "crisisguard_milp_highs_optimizer_v1"
  },
  {
    "allocation_id": "alloc_1bbdade305",
    "incident_id": "INC_04_METRO_TRAUMA_STANDBY",
    "incident_category": "infrastructure_and_utility_damage",
    "urgency_level": "MEDIUM",
    "verification_status": "INSUFFICIENT_EVIDENCE",
    "incident_location": {
      "latitude": 6.7718,
      "longitude": 73.1271,
      "nearest_osm_node": 208410771
    },
    "required_resource_type": "AMBULANCE",
    "demanded_quantity": 1,
    "assigned_resource_id": "RES_AMB_01",
    "assigned_depot_id": "DEPOT_CIVIL_HOSPITAL",
    "assigned_quantity": 1,
    "unmet_quantity": 0,
    "travel_distance_km": 0.0,
    "estimated_travel_time_min": 0.0,
    "routing_method": "OSM_DIJKSTRA",
    "allocation_status": "RECOMMENDED",
    "priority_rationale": "Optimally allocated 1/1 unit(s) from DEPOT_CIVIL_HOSPITAL (RES_AMB_01) based on urgency MEDIUM and travel time 0.0m.",
    "feasibility_status": "FEASIBLE",
    "human_approval_required": true,
    "timestamp": "2026-10-09T07:35:43.609349+00:00",
    "provenance": "crisisguard_milp_highs_optimizer_v1"
  }
]